{
  "imdb_title_id": "tt1230402",
  "title": "Road to Red",
  "original_title": "Road to Red",
  "year": 2020,
  "date_published": "1/3/2020",
  "genre": "Action, Adventure, Comedy",
  "duration": 120,
  "country": "USA, Portugal",
  "language": "English",
  "director": "Tito de Costa",
  "writer": "Larry He heau, Tito de Costa",
  "production_company": "Worldwide Artists",
  "actors": "Sean Gray, Chris Blasman, Renee Dorian, Michael Buffo, Amanda Wing",
  "description": "A surf-skate action-thriller about five best friends who set out",
  "avg_vote": 4.2,
  "votes": 427,
  "budget": "$3,000,000",
  "usa_gross_income": "",
  "worldwide_gross_income": "",
  "metascore": 67,
  "reviews_users": 8,
  "reviews_critics": 10
}